{
  "schemaVersion": 1,
  "id": "KB-2026-0005",
  "slug": "28-ai-implementations",
  "title": "28回AIに実装させ、28回CIが通った。それでも「良い実装」は同じではなかった",
  "description": "14のModel + Agent/Harnessを、.NET基盤構築とAPI実行契約の2課題で独立実装した。候補28件のCIはすべて成功したが、実務で見るべき差は要件適合、Scope、runtime wiring、テストの証拠、変更の最小性に残った。モデル名だけでなく、実行環境と検証方法まで含めて評価する必要がある。",
  "status": "review",
  "publishedAt": null,
  "updatedAt": "2026-08-08",
  "lastVerifiedAt": "2026-08-08",
  "tags": [
    "AIコーディング",
    "AIエージェント",
    "実装比較",
    "ベンチマーク",
    "マルチエージェント",
    "品質保証"
  ],
  "agents": [
    {
      "name": "FND-01 実装比較ベンチマーク",
      "model": "14 Model + Agent/Harness",
      "responseFile": "responses/fnd01-benchmark.md",
      "executedAt": "2026-08-08",
      "webSearch": false,
      "attachmentsUsed": false,
      "integrity": "edited",
      "notes": "minimal-bank-systemのIssue #39、FND-01 benchmark archive、候補PR/CI、Final integrated implementationを一次資料として公開用に整理した。"
    },
    {
      "name": "FND-02 実装比較ベンチマーク",
      "model": "14 Model + Agent/Harness",
      "responseFile": "responses/fnd02-benchmark.md",
      "executedAt": "2026-08-08",
      "webSearch": false,
      "attachmentsUsed": false,
      "integrity": "edited",
      "notes": "minimal-bank-systemのIssue #40、FND-02 benchmark archive、候補PR/CI、Final synthesisと独立レビュー結果を一次資料として公開用に整理した。"
    }
  ],
  "giscusTerm": "KB-2026-0005",
  "supersededBy": null
}
