{
  "schemaVersion": 1,
  "id": "KB-2026-0008",
  "slug": "opencode-linux-agent-vm-poc",
  "title": "OpenCodeをLinux Agent VMで使えるか検証した — SSHトンネル＋Web UIで実用化",
  "description": "Native Remote SSHがないOpenCodeを、Linux Agent VM上で動かしWindowsからSSH経由で使えるかPoCした。結論は、localhost限定のOpenCode WebをSSHポートフォワードで開く構成なら、OpenCode Go、日本語、Git、build/test、Docker、再接続まで実用できた。ただしheadless起動、Git worktree、非対話SSHのPATH、終了処理にはwrapperが必要だった。",
  "status": "published",
  "publishedAt": "2026-09-03",
  "updatedAt": "2026-09-03",
  "lastVerifiedAt": "2026-09-03",
  "tags": [
    "OpenCode",
    "OpenCode Go",
    "AIエージェント",
    "Linux",
    "SSH",
    "開発環境",
    "PoC"
  ],
  "agents": [
    {
      "name": "ChatGPT",
      "model": "GPT-5.6 Sol",
      "responseFile": "responses/chatgpt.md",
      "executedAt": "2026-09-03",
      "webSearch": true,
      "attachmentsUsed": false,
      "integrity": "redacted",
      "notes": "実機PoCの会話ログを公開用に再構成し、ホスト名、IPアドレス、ユーザー名、ローカルパスなどを削除・一般化した。OpenCode側の関連Issueは公開GitHubで再確認した。"
    }
  ],
  "giscusTerm": "KB-2026-0008",
  "supersededBy": null
}
