{
  "schemaVersion": 1,
  "id": "KB-2026-0001",
  "slug": "ai-agent-collaborative-dev-future",
  "title": "AIエージェント協働型開発の未来",
  "description": "希少になるのはコードではなく証拠。ChatGPT・Claude・Geminiの回答と統合分析から、検証・引受・人材戦略の論点を整理する。",
  "status": "published",
  "publishedAt": "2026-07-31",
  "updatedAt": "2026-07-31",
  "lastVerifiedAt": "2026-07-31",
  "tags": [
    "AIエージェント",
    "SDLC",
    "人材戦略",
    "未来予測",
    "検証"
  ],
  "agents": [
    {
      "name": "ChatGPT",
      "model": "GPT-5",
      "responseFile": "responses/chatgpt.md",
      "executedAt": "2026-07-30",
      "webSearch": true,
      "attachmentsUsed": false,
      "integrity": "raw",
      "notes": null
    },
    {
      "name": "Claude",
      "model": "Claude Opus 4",
      "responseFile": "responses/claude.md",
      "executedAt": "2026-07-30",
      "webSearch": true,
      "attachmentsUsed": false,
      "integrity": "raw",
      "notes": null
    },
    {
      "name": "Gemini",
      "model": "Gemini",
      "responseFile": "responses/gemini.md",
      "executedAt": "2026-07-30",
      "webSearch": true,
      "attachmentsUsed": false,
      "integrity": "raw",
      "notes": null
    }
  ],
  "giscusTerm": "KB-2026-0001",
  "supersededBy": null
}
