{
  "schemaVersion": 1,
  "id": "KB-2026-0009",
  "slug": "human-decision-escalation-ai-era",
  "title": "AIが賢くなるほど、人間には何を聞くべきか — Paid InboxからHuman Decision Escalationまで",
  "description": "Paid Inboxの事業案を4つのLLMで複数ラウンド検討し、Human API、Verified Human Judgment、競合比較まで進めた。最終的に残ったのは「AIが分からない時」ではなく、本人の意思・実体験・現実・権限・第三者確認など、Humanでなければ答えの経済的意味が変わる時だけ人間へEscalateする、という原則だった。",
  "status": "published",
  "publishedAt": "2026-09-04",
  "updatedAt": "2026-09-04",
  "lastVerifiedAt": "2026-09-04",
  "tags": [
    "AIエージェント",
    "Human-in-the-loop",
    "Human Decision",
    "新規事業",
    "マルチLLM",
    "リサーチ",
    "Human API"
  ],
  "agents": [
    {
      "name": "Claude",
      "model": "Claude Opus",
      "responseFile": "responses/claude.md",
      "executedAt": "2026-09-04",
      "webSearch": true,
      "attachmentsUsed": true,
      "integrity": "excerpted",
      "notes": "複数ラウンドの長文回答から、公開記事の判断に直接使った論点のみ抜粋。"
    },
    {
      "name": "Gemini",
      "model": "Gemini",
      "responseFile": "responses/gemini.md",
      "executedAt": "2026-09-04",
      "webSearch": true,
      "attachmentsUsed": false,
      "integrity": "excerpted",
      "notes": "複数ラウンドの長文回答から、公開記事の判断に直接使った論点のみ抜粋。"
    },
    {
      "name": "Grok",
      "model": "Grok",
      "responseFile": "responses/grok.md",
      "executedAt": "2026-09-04",
      "webSearch": true,
      "attachmentsUsed": true,
      "integrity": "excerpted",
      "notes": "複数ラウンドの長文回答から、公開記事の判断に直接使った論点のみ抜粋。"
    },
    {
      "name": "ChatGPT",
      "model": "GPT-5.6 Sol",
      "responseFile": "responses/sol.md",
      "executedAt": "2026-09-04",
      "webSearch": true,
      "attachmentsUsed": true,
      "integrity": "excerpted",
      "notes": "複数ラウンドの長文回答から、公開記事の判断に直接使った論点のみ抜粋。"
    }
  ],
  "giscusTerm": "KB-2026-0009",
  "supersededBy": null
}
